{
  "$schema": "../../E2.0-证据.schema.json",
  "schema_version": "e2.0-evidence-v2",
  "evidence_id": "E2-EVID-E09-DEV-20260913",
  "profile_version": "2.0.0",
  "non_gating": true,
  "claim_ids": [
    "E2-REC-001"
  ],
  "criteria": {
    "criteria_id": "E2-CRITERIA-E09-FORMAL-RETEST-20260914",
    "path": "05_docs_ziliao/docs_wendang/architecture/evidence/e2.0/E2.0-E09-正式重测判据-2026-09-14.json",
    "sha256": "sha256:38b6193e797229b55885b79ddc9f704255fa25ae8175b538d125216f0c34db0d",
    "locked_at": "2026-09-13T20:24:21Z",
    "locked_before_execution": true,
    "test_designer": {
      "actor_id": "codex-task-e09-acceptance-repair-20260914",
      "role": "E09 failure-injection test and independent recount operator",
      "organization": "zhudatuan internal",
      "relationship_to_test_item": "Implemented the E09 disposable workload and evidence exporter, executed the production critical-write kernel and operated the separate raw-evidence oracle; not an independent reviewer."
    }
  },
  "test_basis_refs": [
    "05_docs_ziliao/docs_wendang/architecture/evidence/e2.0/E2.0-追踪矩阵.json#E2-REC-001",
    "05_docs_ziliao/docs_wendang/architecture/evidence/SFL-统一节点模型实验矩阵-2026-09-12.json#E09",
    "01_core_hexin/services/commerce/src/foundation/application/ExecutionKernel.ts",
    "01_core_hexin/services/commerce/src/foundation/application/ModuleOperations.ts",
    "01_core_hexin/services/commerce/src/foundation/infrastructure/PgUnitOfWork.ts",
    "02_platform_pingtai/database/supabase/migrations/20260912170000_create_sfl_execution_contract_kernel.sql"
  ],
  "execution": {
    "started_at": "2026-09-13T20:42:26.329Z",
    "completed_at": "2026-09-13T20:43:08.398Z",
    "executor": {
      "actor_id": "codex-task-e09-acceptance-repair-20260914",
      "role": "E09 failure-injection test and independent recount operator",
      "organization": "zhudatuan internal",
      "relationship_to_test_item": "Implemented the E09 disposable workload and evidence exporter, executed the production critical-write kernel and operated the separate raw-evidence oracle; not an independent reviewer."
    },
    "invocations": [
      {
        "kind": "COMMAND",
        "exact": "npm run evidence:e09 -- --evidence-directory 05_docs_ziliao/docs_wendang/architecture/evidence/e2.0/runs/2026-09-14-e09-formal-retest-01",
        "working_directory": "repository root",
        "exit_code": 0,
        "stdout_artifact": "05_docs_ziliao/docs_wendang/architecture/evidence/e2.0/runs/2026-09-14-e09-formal-retest-01/execution-log.json",
        "stderr_artifact": null,
        "sensitive_value_handling": "The generated disposable PostgreSQL password and connection URL were used only in process memory and were not persisted in evidence."
      }
    ]
  },
  "environment": {
    "kind": "DEV",
    "environment_id": "local-disposable-postgresql17-e09-f62994851de943df",
    "description": "A newly created PostgreSQL 17 Alpine container replayed the complete migration chain and executed the locked E09 matrix through the production ExecutionKernel, production PostgreSQL unit of work and production audit projection.",
    "owner": "Ethan-controlled local Codex workspace",
    "isolation": "Disposable Docker container zhudatuan-e09-f62994851de943df; synthetic E09 business rows and deterministic local provider rows only; the container was removed after execution.",
    "real_customer_data": false,
    "production_impact": "None. No production service, database, DNS provider, payment provider, supplier or customer record was contacted.",
    "differences_from_production": [
      "Local disposable Docker PostgreSQL rather than managed Alibaba Cloud PostgreSQL.",
      "Synthetic business actions behind five real registered operation IDs rather than live module handlers or customer traffic.",
      "A deterministic local provider persisted in a separately committed fixture transaction rather than an external payment, DNS or cloud provider.",
      "No stable separately managed staging execution and no production observation."
    ]
  },
  "source_control": {
    "repository": "zdt-next",
    "evidence_commit_sha": "54934c682005c6c1bc1d56cf6b61d9fe7d03f2f0",
    "test_item_shas": [
      "54934c682005c6c1bc1d56cf6b61d9fe7d03f2f0"
    ],
    "execution_tree_state": "CLEAN",
    "diff_sha256": null
  },
  "configuration": {
    "summary": "postgres:17-alpine sha256:18cfe3ef5e6815560c98237d6216d1e5119702fb0f3894c8785dd58b8bbe5d73; 301 migrations; three nodes; five operations; five-way=15; conflict=15; interruptions=60; target recoveries=5.",
    "digest": "sha256:566b9a48a935abd9a3a6cdd63e8046b074b7dd6851d58d05f3a8730ab9b1b4c5",
    "unknown_fields": []
  },
  "raw_observations": [
    {
      "observation_id": "OBS-E09-REQUIRED-RAW-EVIDENCE-MISSING-COUNT",
      "source": "recovery-independent-recount.json",
      "value": {
        "expected": 0,
        "actual": 0,
        "met": true
      },
      "unit": "count",
      "captured_at": "2026-09-13T20:43:08.218Z",
      "notes": "Recomputed from the nine locked raw artifacts; no runner PASS/status field was read."
    },
    {
      "observation_id": "OBS-E09-OPERATION-NODE-SCENARIO-COMPLETENESS-MISMATCH-COUNT",
      "source": "recovery-independent-recount.json",
      "value": {
        "expected": 0,
        "actual": 0,
        "met": true
      },
      "unit": "count",
      "captured_at": "2026-09-13T20:43:08.218Z",
      "notes": "Recomputed from the nine locked raw artifacts; no runner PASS/status field was read."
    },
    {
      "observation_id": "OBS-E09-AUTHORITATIVE-RESULT-COUNT-MISMATCH-COUNT",
      "source": "recovery-independent-recount.json",
      "value": {
        "expected": 0,
        "actual": 0,
        "met": true
      },
      "unit": "count",
      "captured_at": "2026-09-13T20:43:08.218Z",
      "notes": "Recomputed from the nine locked raw artifacts; no runner PASS/status field was read."
    },
    {
      "observation_id": "OBS-E09-IDENTICAL-RESPONSE-BUSINESS-ID-MISMATCH-COUNT",
      "source": "recovery-independent-recount.json",
      "value": {
        "expected": 0,
        "actual": 0,
        "met": true
      },
      "unit": "count",
      "captured_at": "2026-09-13T20:43:08.218Z",
      "notes": "Recomputed from the nine locked raw artifacts; no runner PASS/status field was read."
    },
    {
      "observation_id": "OBS-E09-REQUEST-HASH-OR-IDEMPOTENCY-KEY-MISSING-COUNT",
      "source": "recovery-independent-recount.json",
      "value": {
        "expected": 0,
        "actual": 0,
        "met": true
      },
      "unit": "count",
      "captured_at": "2026-09-13T20:43:08.218Z",
      "notes": "Recomputed from the nine locked raw artifacts; no runner PASS/status field was read."
    },
    {
      "observation_id": "OBS-E09-CONFLICT-REJECTION-MISMATCH-COUNT",
      "source": "recovery-independent-recount.json",
      "value": {
        "expected": 0,
        "actual": 0,
        "met": true
      },
      "unit": "count",
      "captured_at": "2026-09-13T20:43:08.218Z",
      "notes": "Recomputed from the nine locked raw artifacts; no runner PASS/status field was read."
    },
    {
      "observation_id": "OBS-E09-CONFLICT-STATE-CHANGE-COUNT",
      "source": "recovery-independent-recount.json",
      "value": {
        "expected": 0,
        "actual": 0,
        "met": true
      },
      "unit": "count",
      "captured_at": "2026-09-13T20:43:08.218Z",
      "notes": "Recomputed from the nine locked raw artifacts; no runner PASS/status field was read."
    },
    {
      "observation_id": "OBS-E09-DUPLICATE-BUSINESS-PROVIDER-AUDIT-OR-OUTBOX-SIDE-EFFECT-COUNT",
      "source": "recovery-independent-recount.json",
      "value": {
        "expected": 0,
        "actual": 0,
        "met": true
      },
      "unit": "count",
      "captured_at": "2026-09-13T20:43:08.218Z",
      "notes": "Recomputed from the nine locked raw artifacts; no runner PASS/status field was read."
    },
    {
      "observation_id": "OBS-E09-INTERRUPTION-RECOVERY-SCENARIO-COMPLETENESS-MISMATCH-COUNT",
      "source": "recovery-independent-recount.json",
      "value": {
        "expected": 0,
        "actual": 0,
        "met": true
      },
      "unit": "count",
      "captured_at": "2026-09-13T20:43:08.218Z",
      "notes": "Recomputed from the nine locked raw artifacts; no runner PASS/status field was read."
    },
    {
      "observation_id": "OBS-E09-UNCLASSIFIED-PARTIAL-STATE-COUNT",
      "source": "recovery-independent-recount.json",
      "value": {
        "expected": 0,
        "actual": 0,
        "met": true
      },
      "unit": "count",
      "captured_at": "2026-09-13T20:43:08.218Z",
      "notes": "Recomputed from the nine locked raw artifacts; no runner PASS/status field was read."
    },
    {
      "observation_id": "OBS-E09-RETRY-TERMINAL-STATE-MISMATCH-COUNT",
      "source": "recovery-independent-recount.json",
      "value": {
        "expected": 0,
        "actual": 0,
        "met": true
      },
      "unit": "count",
      "captured_at": "2026-09-13T20:43:08.218Z",
      "notes": "Recomputed from the nine locked raw artifacts; no runner PASS/status field was read."
    },
    {
      "observation_id": "OBS-E09-PROVIDER-RECEIPT-MISSING-OR-DUPLICATE-COUNT",
      "source": "recovery-independent-recount.json",
      "value": {
        "expected": 0,
        "actual": 0,
        "met": true
      },
      "unit": "count",
      "captured_at": "2026-09-13T20:43:08.218Z",
      "notes": "Recomputed from the nine locked raw artifacts; no runner PASS/status field was read."
    },
    {
      "observation_id": "OBS-E09-NON-TARGET-NODE-CHANGE-COUNT",
      "source": "recovery-independent-recount.json",
      "value": {
        "expected": 0,
        "actual": 0,
        "met": true
      },
      "unit": "count",
      "captured_at": "2026-09-13T20:43:08.218Z",